{
  "$schema": "https://json-schema.org/draft/2020-12/schema",
  "$id": "https://raw.githubusercontent.com/JalenBuildsHub/PermitMesh/main/schema/permitmesh-buzz-context.schema.json",
  "title": "PermitMesh Trusted Buzz Context 0.1",
  "description": "Facts supplied by a trusted Buzz integration. Schema validity is not signature or protection verification.",
  "type": "object",
  "additionalProperties": false,
  "required": [
    "context_version",
    "community_uri",
    "contract_digest",
    "producer_id",
    "context_mac",
    "owner_pubkey",
    "agent_pubkey",
    "owner_attestation_event_id",
    "repository_announcement_event_id",
    "nip_oa_verified",
    "repository",
    "ref",
    "channel",
    "protection_checked",
    "verified_at"
  ],
  "properties": {
    "context_version": {"const": "0.1"},
    "community_uri": {
      "type": "string",
      "pattern": "^(?:https|wss)://(?:[a-z0-9](?:[a-z0-9-]{0,61}[a-z0-9])?\\.)+[a-z0-9](?:[a-z0-9-]{0,61}[a-z0-9])?(?:/[A-Za-z0-9._~!$&'()*+,;=:@%/-]*)?$"
    },
    "contract_digest": {"type": "string", "pattern": "^[0-9a-f]{64}$"},
    "producer_id": {
      "type": "string",
      "pattern": "^[A-Za-z0-9._:/-]{3,128}$"
    },
    "context_mac": {"type": "string", "pattern": "^[0-9a-f]{64}$"},
    "owner_pubkey": {"type": "string", "pattern": "^[0-9a-f]{64}$"},
    "agent_pubkey": {"type": "string", "pattern": "^[0-9a-f]{64}$"},
    "owner_attestation_event_id": {
      "type": "string",
      "pattern": "^[0-9a-f]{64}$"
    },
    "repository_announcement_event_id": {
      "type": "string",
      "pattern": "^[0-9a-f]{64}$"
    },
    "nip_oa_verified": {"const": true},
    "repository": {"type": "string", "minLength": 1},
    "ref": {"type": "string", "minLength": 1},
    "channel": {"type": "string", "minLength": 1},
    "protection_checked": {"const": true},
    "verified_at": {
      "type": "string",
      "format": "date-time",
      "pattern": "^\\d{4}-\\d{2}-\\d{2}T\\d{2}:\\d{2}:\\d{2}(?:\\.\\d+)?(?:Z|[+-]\\d{2}:\\d{2})$"
    }
  }
}
