{
  "context_version": "0.1",
  "community_uri": "wss://relay.example.com/permitmesh",
  "contract_digest": "8ea8fd8307a5e05cb2c56e31a66edb6bb233a111c567cc72315a31219b14fe0a",
  "producer_id": "buzz-gateway.example",
  "context_mac": "769f4359a7cf8bce4d564a3b43097113dabab06de6b2f6b5ce3c416383a3e794",
  "owner_pubkey": "79be667ef9dcbbac55a06295ce870b07029bfcdb2dce28d959f2815b16f81798",
  "agent_pubkey": "c6047f9441ed7d6d3045406e95c07cd85c778e4b8cef3ca7abac09b95c709ee5",
  "owner_attestation_event_id": "aaaaaaaaaaaaaaaaaaaaaaaaaaaaaaaaaaaaaaaaaaaaaaaaaaaaaaaaaaaaaaaa",
  "repository_announcement_event_id": "bbbbbbbbbbbbbbbbbbbbbbbbbbbbbbbbbbbbbbbbbbbbbbbbbbbbbbbbbbbbbbbb",
  "nip_oa_verified": true,
  "repository": "PermitMesh",
  "ref": "feature//agent-contract",
  "channel": "permitmesh\\feature-agent-contract",
  "protection_checked": true,
  "verified_at": "2026-07-23T12:00:00Z"
}
